{"schema_version":1,"provider":{"mod_id":"cpm","physical_version":"0.6.27a","source_repository":"UNRESOLVED","source_ref":"UNRESOLVED","audited_at":"2026-09-12","loader":"neoforge","minecraft_version":"1.21.1","license":"UNRESOLVED","confidence":"UNRESOLVED","state":"REFERENCE_ONLY"},"capabilities":[{"capability_id":"i7_curated_provider_boundary","state":"CONFIRMED","evidence":["STATUS.md: PR12 CPM source-preserving provider policy and regression contract"]}],"evidence":{"sources":["engineering/catalog/sources/SOURCE-REGISTRY.json","STATUS.md"],"notes":["I7 proof ceiling: P2 SOURCE/DOC_VERIFIED.","License remains UNRESOLVED until explicit canonical evidence is audited."]}}
