{"schema_version":1,"provider":{"mod_id":"player_animation_library","physical_version":"1.1.6+mc.1.21.1","source_repository":"UNRESOLVED","source_ref":"UNRESOLVED","audited_at":"2026-09-12","loader":"neoforge","minecraft_version":"1.21.1","license":"UNRESOLVED","confidence":"UNRESOLVED","state":"REFERENCE_ONLY"},"capabilities":[{"capability_id":"i7_curated_provider_boundary","state":"CONFIRMED","evidence":["STATUS.md: PR12 PAL source-preserving runtime-consumer handoff profile"]}],"evidence":{"sources":["engineering/catalog/sources/SOURCE-REGISTRY.json","STATUS.md"],"notes":["I7 proof ceiling: P2 SOURCE/DOC_VERIFIED.","License remains UNRESOLVED until explicit canonical evidence is audited."]}}
