{"schema_version":1,"provider":{"mod_id":"geckolib","physical_version":"4.9.2","source_repository":"UNRESOLVED","source_ref":"UNRESOLVED","audited_at":"2026-09-12","loader":"neoforge","minecraft_version":"1.21.1","license":"UNRESOLVED","confidence":"UNRESOLVED","state":"REFERENCE_ONLY"},"capabilities":[{"capability_id":"i7_curated_provider_boundary","state":"PASS","evidence":["STATUS.md: I6_REAL_HANDOFF=PASS and native GeckoLib golden-sample real handoff PASS"]}],"evidence":{"sources":["engineering/catalog/sources/SOURCE-REGISTRY.json","STATUS.md"],"notes":["I7 proof ceiling: P5 INTEGRATION_TESTED.","License remains UNRESOLVED until explicit canonical evidence is audited."]}}
