{"schema_version":1,"provider":{"mod_id":"create","physical_version":"6.0.10","source_repository":"UNRESOLVED","source_ref":"UNRESOLVED","audited_at":"2026-09-12","loader":"neoforge","minecraft_version":"1.21.1","license":"UNRESOLVED","confidence":"UNRESOLVED","state":"UNRESOLVED"},"capabilities":[{"capability_id":"i7_curated_provider_boundary","state":"CONFIRMED","evidence":["engineering/catalog/sources/SOURCE-REGISTRY.json: physical snapshot confirms installed presence/version only"]}],"evidence":{"sources":["engineering/catalog/sources/SOURCE-REGISTRY.json","STATUS.md"],"notes":["I7 proof ceiling: P0 PRESENCE_ONLY.","License remains UNRESOLVED until explicit canonical evidence is audited."]}}
