{"schema_version":1,"provider":{"mod_id":"playeranimator","physical_version":"2.0.4+1.21.1","source_repository":"KosmX/minecraftPlayerAnimator","source_ref":"cb3227efc19ec46065597332ae265076d0f2b495","audited_at":"2026-09-12","loader":"neoforge","minecraft_version":"1.21.1","license":"UNRESOLVED","confidence":"HIGH","state":"CONFIRMED"},"capabilities":[{"capability_id":"i7_curated_provider_boundary","state":"CONFIRMED","evidence":["STATUS.md: PR12 Player Animator exact source authority and side-boundary audit"]}],"evidence":{"sources":["engineering/catalog/sources/SOURCE-REGISTRY.json","STATUS.md"],"notes":["I7 proof ceiling: P2 SOURCE/DOC_VERIFIED.","License remains UNRESOLVED until explicit canonical evidence is audited."]}}
