{"schema_version":1,"provider":{"mod_id":"easy_model_entities","physical_version":"2.3.0","source_repository":"MarkusBordihn/BOs-Easy-Model-Entities","source_ref":"8c912371838c2a26bbb383008ad3999280f075d1","audited_at":"2026-09-12","loader":"neoforge","minecraft_version":"1.21.1","license":"UNRESOLVED","confidence":"HIGH","state":"CONFIRMED"},"capabilities":[{"capability_id":"i7_curated_provider_boundary","state":"CONFIRMED","evidence":["STATUS.md: PR9 target-exact source GameTest evidence; physical full-modpack runtime remains unproven"]}],"evidence":{"sources":["engineering/catalog/sources/SOURCE-REGISTRY.json","STATUS.md"],"notes":["I7 proof ceiling: P4 RUNTIME_SMOKE.","License remains UNRESOLVED until explicit canonical evidence is audited."]}}
