{"schema_version":1,"provider":{"mod_id":"entity_model_features","physical_version":"3.3.5","source_repository":"Traben-0/Entity_Model_Features","source_ref":"02034eb0f102040b16900be7c900eff88da89e9e","audited_at":"2026-09-12","loader":"neoforge","minecraft_version":"1.21.1","license":"UNRESOLVED","confidence":"MEDIUM","state":"REFERENCE_ONLY"},"capabilities":[{"capability_id":"i7_curated_provider_boundary","state":"CONFIRMED","evidence":["STATUS.md: PR10 EMF source/runtime-authority audit; target-exact runtime remains unproven"]}],"evidence":{"sources":["engineering/catalog/sources/SOURCE-REGISTRY.json","STATUS.md"],"notes":["I7 proof ceiling: P2 SOURCE/DOC_VERIFIED.","License remains UNRESOLVED until explicit canonical evidence is audited."]}}
