{"schema_version":1,"provider":{"mod_id":"epicfight","physical_version":"21.17.3.1","source_repository":"UNRESOLVED","source_ref":"UNRESOLVED","audited_at":"2026-09-12","loader":"neoforge","minecraft_version":"1.21.1","license":"UNRESOLVED","confidence":"UNRESOLVED","state":"UNRESOLVED"},"capabilities":[{"capability_id":"i7_curated_provider_boundary","state":"CONFIRMED","evidence":["STATUS.md: PR13 source/docs audit; exact physical-binary mapping and target runtime remain unproven"]}],"evidence":{"sources":["engineering/catalog/sources/SOURCE-REGISTRY.json","STATUS.md"],"notes":["I7 proof ceiling: P2 SOURCE/DOC_VERIFIED.","License remains UNRESOLVED until explicit canonical evidence is audited."]}}
