{"schema_version":1,"provider":{"mod_id":"azurelib","physical_version":"3.1.11","source_repository":"AzureDoom/AzureLib","source_ref":"74ca485d43089c6953492ae7a10fc896eda30385","audited_at":"2026-09-12","loader":"neoforge","minecraft_version":"1.21.1","license":"UNRESOLVED","confidence":"HIGH","state":"CONFIRMED"},"capabilities":[{"capability_id":"i7_curated_provider_boundary","state":"CONFIRMED","evidence":["STATUS.md: PR7 AzureLib 3.1.11 runtime/authoring authority audit; live runtime remains unproven"]}],"evidence":{"sources":["engineering/catalog/sources/SOURCE-REGISTRY.json","STATUS.md"],"notes":["I7 proof ceiling: P2 SOURCE/DOC_VERIFIED.","License remains UNRESOLVED until explicit canonical evidence is audited."]}}
